[
  {
    "id": "1-1",
    "theme": "pokemon-style town",
    "size": [
      26,
      22
    ],
    "tiles": [
      [
        2,
        2,
        2,
        2,
        2,
        2,
        2,
        2,
        2,
        2,
        2,
        2,
        2,
        2,
        2,
        2,
        2,
        2,
        2,
        2,
        2,
        2,
        2,
        2,
        2,
        2
      ],
      [
        2,
        2,
        2,
        2,
        2,
        2,
        2,
        2,
        2,
        2,
        2,
        2,
        2,
        2,
        2,
        2,
        2,
        2,
        2,
        2,
        2,
        2,
        2,
        2,
        2,
        2
      ],
      [
        2,
        2,
        0,
        0,
        2,
        0,
        0,
        2,
        0,
        0,
        2,
        0,
        1,
        1,
        0,
        2,
        0,
        0,
        2,
        0,
        0,
        2,
        0,
        0,
        2,
        2
      ],
      [
        2,
        2,
        0,
        0,
        5,
        5,
        5,
        5,
        5,
        0,
        0,
        0,
        1,
        1,
        0,
        0,
        5,
        5,
        5,
        5,
        5,
        0,
        0,
        0,
        2,
        2
      ],
      [
        2,
        2,
        2,
        0,
        5,
        5,
        5,
        5,
        5,
        0,
        0,
        0,
        1,
        1,
        0,
        0,
        5,
        5,
        5,
        5,
        5,
        0,
        0,
        2,
        2,
        2
      ],
      [
        2,
        2,
        0,
        0,
        4,
        4,
        4,
        4,
        4,
        0,
        0,
        0,
        1,
        1,
        0,
        0,
        4,
        4,
        4,
        4,
        4,
        0,
        0,
        0,
        2,
        2
      ],
      [
        2,
        2,
        0,
        0,
        4,
        4,
        4,
        4,
        4,
        0,
        0,
        0,
        1,
        1,
        0,
        0,
        4,
        4,
        4,
        4,
        4,
        0,
        0,
        0,
        2,
        2
      ],
      [
        2,
        2,
        2,
        0,
        4,
        4,
        4,
        4,
        4,
        0,
        0,
        0,
        1,
        1,
        0,
        0,
        4,
        4,
        4,
        4,
        4,
        0,
        0,
        2,
        2,
        2
      ],
      [
        2,
        2,
        0,
        0,
        3,
        3,
        3,
        0,
        0,
        0,
        0,
        0,
        1,
        1,
        0,
        0,
        3,
        3,
        3,
        0,
        0,
        0,
        0,
        0,
        2,
        2
      ],
      [
        2,
        2,
        6,
        6,
        6,
        6,
        6,
        6,
        6,
        6,
        6,
        6,
        1,
        1,
        6,
        6,
        6,
        6,
        6,
        6,
        6,
        6,
        6,
        6,
        2,
        2
      ],
      [
        2,
        2,
        1,
        1,
        1,
        1,
        1,
        1,
        1,
        1,
        1,
        1,
        1,
        1,
        1,
        1,
        1,
        1,
        1,
        1,
        1,
        1,
        1,
        1,
        2,
        2
      ],
      [
        2,
        2,
        1,
        1,
        1,
        1,
        1,
        1,
        1,
        1,
        1,
        1,
        1,
        1,
        1,
        1,
        1,
        1,
        1,
        1,
        1,
        1,
        1,
        1,
        2,
        2
      ],
      [
        2,
        2,
        0,
        3,
        3,
        3,
        0,
        0,
        0,
        0,
        0,
        0,
        1,
        1,
        0,
        0,
        0,
        0,
        0,
        0,
        3,
        3,
        3,
        3,
        2,
        2
      ],
      [
        2,
        2,
        2,
        0,
        0,
        0,
        0,
        0,
        5,
        5,
        5,
        5,
        5,
        5,
        5,
        5,
        5,
        5,
        0,
        0,
        0,
        0,
        0,
        2,
        2,
        2
      ],
      [
        2,
        2,
        0,
        0,
        0,
        0,
        0,
        0,
        5,
        5,
        5,
        5,
        5,
        5,
        5,
        5,
        5,
        5,
        0,
        7,
        7,
        7,
        7,
        7,
        2,
        2
      ],
      [
        2,
        2,
        0,
        0,
        0,
        0,
        0,
        0,
        4,
        4,
        4,
        4,
        4,
        4,
        4,
        4,
        4,
        4,
        0,
        7,
        7,
        7,
        7,
        7,
        2,
        2
      ],
      [
        2,
        2,
        2,
        0,
        0,
        0,
        0,
        0,
        4,
        4,
        4,
        4,
        4,
        4,
        4,
        4,
        4,
        4,
        0,
        7,
        7,
        7,
        7,
        7,
        2,
        2
      ],
      [
        2,
        2,
        0,
        0,
        0,
        0,
        0,
        0,
        4,
        4,
        4,
        4,
        4,
        4,
        4,
        4,
        4,
        4,
        0,
        7,
        7,
        7,
        7,
        7,
        2,
        2
      ],
      [
        2,
        2,
        0,
        0,
        3,
        3,
        0,
        0,
        0,
        0,
        0,
        0,
        1,
        1,
        0,
        0,
        0,
        0,
        0,
        0,
        0,
        0,
        0,
        0,
        2,
        2
      ],
      [
        2,
        2,
        0,
        0,
        2,
        3,
        0,
        2,
        0,
        0,
        2,
        0,
        1,
        1,
        0,
        2,
        0,
        0,
        2,
        0,
        0,
        2,
        0,
        0,
        2,
        2
      ],
      [
        2,
        2,
        2,
        2,
        2,
        2,
        2,
        2,
        2,
        2,
        2,
        2,
        2,
        2,
        2,
        2,
        2,
        2,
        2,
        2,
        2,
        2,
        2,
        2,
        2,
        2
      ],
      [
        2,
        2,
        2,
        2,
        2,
        2,
        2,
        2,
        2,
        2,
        2,
        2,
        2,
        2,
        2,
        2,
        2,
        2,
        2,
        2,
        2,
        2,
        2,
        2,
        2,
        2
      ]
    ],
    "spawns": [
      {
        "entity": "TRAINER",
        "x": 12,
        "y": 10
      },
      {
        "entity": "NPC_GIRL",
        "x": 6,
        "y": 8
      },
      {
        "entity": "NPC_BOY",
        "x": 17,
        "y": 8
      },
      {
        "entity": "NPC_ELDER",
        "x": 10,
        "y": 12
      },
      {
        "entity": "NPC_GIRL",
        "x": 20,
        "y": 12
      },
      {
        "entity": "CHEST",
        "x": 7,
        "y": 7
      },
      {
        "entity": "CHEST",
        "x": 19,
        "y": 7
      },
      {
        "entity": "CHEST",
        "x": 5,
        "y": 18
      },
      {
        "entity": "CHEST",
        "x": 19,
        "y": 13
      },
      {
        "entity": "CHEST",
        "x": 10,
        "y": 5
      }
    ]
  }
]