[
  {
    "id": "1-1",
    "theme": "deep space",
    "size": [
      15,
      11
    ],
    "tiles": [
      [
        0,
        0,
        0,
        0,
        0,
        0,
        0,
        2,
        0,
        0,
        0,
        0,
        0,
        0,
        0
      ],
      [
        0,
        0,
        1,
        1,
        0,
        0,
        0,
        0,
        0,
        0,
        0,
        0,
        0,
        0,
        0
      ],
      [
        0,
        0,
        1,
        0,
        0,
        2,
        0,
        0,
        0,
        0,
        0,
        0,
        0,
        0,
        0
      ],
      [
        0,
        0,
        0,
        0,
        0,
        0,
        0,
        0,
        0,
        0,
        0,
        0,
        2,
        0,
        0
      ],
      [
        0,
        2,
        0,
        0,
        0,
        0,
        0,
        0,
        0,
        2,
        0,
        0,
        0,
        0,
        0
      ],
      [
        0,
        0,
        0,
        0,
        0,
        0,
        0,
        0,
        0,
        0,
        0,
        0,
        0,
        0,
        0
      ],
      [
        0,
        0,
        0,
        0,
        0,
        0,
        2,
        0,
        0,
        0,
        0,
        0,
        0,
        0,
        0
      ],
      [
        0,
        0,
        2,
        0,
        0,
        0,
        0,
        0,
        0,
        0,
        0,
        0,
        0,
        2,
        0
      ],
      [
        0,
        0,
        0,
        0,
        0,
        0,
        0,
        0,
        0,
        0,
        1,
        1,
        0,
        0,
        0
      ],
      [
        0,
        0,
        0,
        0,
        2,
        0,
        0,
        0,
        0,
        0,
        0,
        1,
        0,
        0,
        0
      ],
      [
        0,
        0,
        0,
        0,
        0,
        0,
        0,
        0,
        2,
        0,
        0,
        0,
        0,
        0,
        0
      ]
    ],
    "spawns": [
      {
        "entity": "SHIP",
        "x": 7,
        "y": 9
      },
      {
        "entity": "FIGHTER",
        "x": 4,
        "y": 1
      },
      {
        "entity": "FIGHTER",
        "x": 7,
        "y": 0
      },
      {
        "entity": "FIGHTER",
        "x": 11,
        "y": 1
      },
      {
        "entity": "BOMBER",
        "x": 5,
        "y": 3
      },
      {
        "entity": "BOMBER",
        "x": 10,
        "y": 3
      },
      {
        "entity": "GEM",
        "x": 7,
        "y": 5
      }
    ]
  }
]