[
  {
    "id": "1-1",
    "theme": "space",
    "size": [
      16,
      12
    ],
    "tiles": [
      [
        0,
        0,
        1,
        0,
        0,
        0,
        0,
        0,
        0,
        0,
        0,
        1,
        0,
        0,
        0,
        0
      ],
      [
        0,
        0,
        0,
        0,
        0,
        2,
        0,
        0,
        0,
        0,
        0,
        0,
        0,
        0,
        1,
        0
      ],
      [
        1,
        0,
        0,
        0,
        0,
        0,
        0,
        0,
        0,
        0,
        0,
        0,
        0,
        0,
        0,
        0
      ],
      [
        0,
        0,
        0,
        0,
        0,
        0,
        0,
        0,
        0,
        2,
        2,
        0,
        0,
        0,
        0,
        0
      ],
      [
        0,
        0,
        0,
        1,
        0,
        0,
        0,
        0,
        0,
        0,
        0,
        0,
        0,
        0,
        0,
        0
      ],
      [
        0,
        0,
        0,
        0,
        0,
        0,
        0,
        0,
        0,
        0,
        0,
        0,
        0,
        1,
        0,
        0
      ],
      [
        0,
        2,
        0,
        0,
        0,
        0,
        0,
        0,
        0,
        0,
        0,
        0,
        0,
        0,
        0,
        0
      ],
      [
        0,
        0,
        0,
        0,
        0,
        0,
        1,
        0,
        0,
        0,
        0,
        0,
        0,
        0,
        0,
        0
      ],
      [
        0,
        0,
        0,
        0,
        0,
        0,
        0,
        0,
        0,
        0,
        0,
        0,
        0,
        0,
        0,
        0
      ],
      [
        0,
        0,
        0,
        0,
        0,
        0,
        0,
        0,
        0,
        0,
        0,
        0,
        0,
        0,
        0,
        0
      ],
      [
        0,
        0,
        0,
        0,
        0,
        0,
        0,
        0,
        0,
        0,
        0,
        0,
        0,
        0,
        0,
        0
      ],
      [
        0,
        0,
        0,
        0,
        0,
        0,
        0,
        0,
        0,
        0,
        0,
        0,
        0,
        0,
        0,
        0
      ]
    ],
    "spawns": [
      {
        "entity": "SHIP",
        "x": 8,
        "y": 10
      }
    ],
    "goal": {
      "kind": "tile"
    }
  }
]