[
  {
    "id": "1-1",
    "theme": "forest",
    "size": [
      16,
      12
    ],
    "tiles": [
      [
        2,
        2,
        2,
        2,
        2,
        2,
        2,
        2,
        2,
        2,
        2,
        2,
        2,
        2,
        2,
        2
      ],
      [
        2,
        0,
        0,
        0,
        0,
        0,
        3,
        0,
        0,
        0,
        0,
        0,
        0,
        0,
        0,
        2
      ],
      [
        2,
        0,
        1,
        1,
        0,
        0,
        0,
        0,
        0,
        3,
        0,
        0,
        1,
        1,
        0,
        2
      ],
      [
        2,
        0,
        1,
        0,
        0,
        0,
        3,
        0,
        0,
        0,
        0,
        0,
        1,
        0,
        0,
        2
      ],
      [
        2,
        0,
        0,
        0,
        0,
        0,
        0,
        0,
        0,
        0,
        0,
        0,
        0,
        0,
        0,
        2
      ],
      [
        2,
        0,
        0,
        3,
        0,
        0,
        0,
        0,
        0,
        0,
        0,
        3,
        0,
        0,
        0,
        2
      ],
      [
        2,
        0,
        0,
        0,
        0,
        0,
        0,
        0,
        0,
        0,
        0,
        0,
        0,
        0,
        0,
        2
      ],
      [
        2,
        0,
        1,
        0,
        0,
        3,
        0,
        0,
        0,
        0,
        0,
        0,
        0,
        1,
        0,
        2
      ],
      [
        2,
        0,
        1,
        0,
        0,
        0,
        0,
        0,
        0,
        3,
        0,
        0,
        0,
        1,
        0,
        2
      ],
      [
        2,
        0,
        0,
        0,
        0,
        0,
        0,
        0,
        0,
        0,
        0,
        0,
        0,
        0,
        0,
        2
      ],
      [
        2,
        0,
        0,
        0,
        0,
        3,
        0,
        0,
        0,
        0,
        0,
        0,
        0,
        0,
        0,
        2
      ],
      [
        2,
        2,
        2,
        2,
        2,
        2,
        2,
        2,
        2,
        2,
        2,
        2,
        2,
        2,
        2,
        2
      ]
    ],
    "spawns": [
      {
        "entity": "KNIGHT",
        "x": 2,
        "y": 2
      },
      {
        "entity": "SLIME",
        "x": 8,
        "y": 4
      },
      {
        "entity": "SLIME",
        "x": 4,
        "y": 7
      },
      {
        "entity": "SLIME",
        "x": 12,
        "y": 9
      },
      {
        "entity": "GEM",
        "x": 13,
        "y": 2
      },
      {
        "entity": "GEM",
        "x": 7,
        "y": 6
      },
      {
        "entity": "GEM",
        "x": 2,
        "y": 10
      }
    ],
    "goal": {
      "kind": "tile"
    }
  }
]