[
  {
    "id": "1-1",
    "theme": "toxic sewer depths",
    "size": [
      22,
      32
    ],
    "tiles": [
      [
        1,
        1,
        1,
        1,
        1,
        1,
        1,
        1,
        1,
        1,
        1,
        1,
        1,
        1,
        1,
        1,
        1,
        1,
        1,
        1,
        1,
        1
      ],
      [
        1,
        0,
        0,
        0,
        0,
        0,
        0,
        0,
        0,
        0,
        0,
        0,
        0,
        0,
        0,
        0,
        0,
        0,
        0,
        0,
        0,
        1
      ],
      [
        1,
        0,
        0,
        0,
        0,
        0,
        0,
        0,
        0,
        0,
        0,
        0,
        0,
        0,
        0,
        0,
        0,
        0,
        0,
        0,
        0,
        1
      ],
      [
        1,
        0,
        0,
        0,
        0,
        0,
        0,
        0,
        0,
        0,
        0,
        0,
        0,
        0,
        0,
        0,
        0,
        0,
        0,
        0,
        0,
        1
      ],
      [
        1,
        0,
        0,
        1,
        0,
        0,
        0,
        0,
        0,
        0,
        0,
        0,
        0,
        0,
        0,
        0,
        0,
        0,
        1,
        0,
        0,
        1
      ],
      [
        1,
        0,
        0,
        1,
        1,
        1,
        1,
        1,
        1,
        1,
        1,
        1,
        1,
        1,
        1,
        1,
        1,
        1,
        1,
        0,
        0,
        1
      ],
      [
        1,
        0,
        0,
        0,
        0,
        0,
        0,
        0,
        0,
        0,
        4,
        0,
        0,
        0,
        0,
        0,
        0,
        0,
        0,
        0,
        0,
        1
      ],
      [
        1,
        0,
        0,
        0,
        0,
        0,
        0,
        0,
        0,
        0,
        4,
        0,
        0,
        0,
        0,
        0,
        0,
        0,
        0,
        0,
        0,
        1
      ],
      [
        1,
        0,
        0,
        0,
        0,
        0,
        0,
        0,
        0,
        0,
        4,
        0,
        0,
        0,
        0,
        0,
        0,
        0,
        0,
        0,
        0,
        1
      ],
      [
        1,
        0,
        0,
        0,
        0,
        0,
        0,
        1,
        0,
        0,
        4,
        0,
        0,
        0,
        0,
        0,
        0,
        0,
        0,
        0,
        0,
        1
      ],
      [
        1,
        1,
        1,
        1,
        1,
        0,
        0,
        1,
        1,
        1,
        1,
        1,
        1,
        0,
        0,
        0,
        1,
        1,
        1,
        1,
        1,
        1
      ],
      [
        1,
        0,
        0,
        0,
        0,
        0,
        0,
        0,
        4,
        0,
        0,
        0,
        0,
        0,
        0,
        0,
        0,
        0,
        0,
        4,
        0,
        1
      ],
      [
        1,
        0,
        0,
        0,
        0,
        0,
        0,
        0,
        4,
        0,
        0,
        0,
        0,
        0,
        0,
        0,
        0,
        0,
        0,
        4,
        0,
        1
      ],
      [
        1,
        0,
        0,
        0,
        0,
        0,
        0,
        0,
        4,
        0,
        0,
        0,
        0,
        0,
        0,
        0,
        0,
        0,
        0,
        4,
        0,
        1
      ],
      [
        1,
        0,
        0,
        0,
        0,
        0,
        0,
        0,
        4,
        0,
        0,
        1,
        0,
        0,
        0,
        0,
        0,
        0,
        0,
        4,
        0,
        1
      ],
      [
        1,
        0,
        0,
        1,
        1,
        1,
        1,
        1,
        0,
        0,
        0,
        1,
        1,
        1,
        1,
        1,
        0,
        1,
        1,
        1,
        1,
        1
      ],
      [
        1,
        0,
        0,
        4,
        0,
        0,
        0,
        0,
        0,
        0,
        0,
        0,
        0,
        0,
        0,
        0,
        4,
        0,
        0,
        0,
        0,
        1
      ],
      [
        1,
        0,
        0,
        4,
        0,
        0,
        0,
        0,
        0,
        0,
        0,
        0,
        0,
        0,
        0,
        0,
        4,
        0,
        0,
        0,
        0,
        1
      ],
      [
        1,
        0,
        0,
        4,
        0,
        0,
        0,
        0,
        0,
        0,
        0,
        0,
        0,
        0,
        0,
        0,
        4,
        0,
        0,
        0,
        0,
        1
      ],
      [
        1,
        0,
        0,
        4,
        0,
        0,
        0,
        0,
        0,
        0,
        0,
        0,
        0,
        0,
        0,
        1,
        4,
        0,
        0,
        0,
        0,
        1
      ],
      [
        1,
        1,
        1,
        1,
        1,
        1,
        0,
        0,
        1,
        1,
        1,
        1,
        1,
        0,
        0,
        1,
        1,
        1,
        1,
        1,
        0,
        1
      ],
      [
        1,
        0,
        0,
        0,
        0,
        4,
        0,
        0,
        0,
        0,
        0,
        0,
        0,
        4,
        0,
        0,
        0,
        0,
        4,
        0,
        0,
        1
      ],
      [
        1,
        0,
        0,
        0,
        0,
        4,
        0,
        0,
        0,
        0,
        0,
        0,
        0,
        4,
        0,
        0,
        0,
        0,
        4,
        0,
        0,
        1
      ],
      [
        1,
        0,
        0,
        0,
        0,
        4,
        0,
        3,
        3,
        0,
        0,
        0,
        0,
        4,
        0,
        0,
        0,
        0,
        4,
        0,
        0,
        1
      ],
      [
        1,
        0,
        0,
        0,
        0,
        4,
        1,
        0,
        0,
        0,
        0,
        0,
        0,
        4,
        0,
        0,
        0,
        1,
        4,
        0,
        0,
        1
      ],
      [
        1,
        0,
        1,
        1,
        1,
        1,
        1,
        0,
        0,
        0,
        1,
        1,
        1,
        1,
        1,
        0,
        0,
        1,
        1,
        1,
        1,
        1
      ],
      [
        1,
        0,
        0,
        0,
        0,
        0,
        0,
        0,
        0,
        0,
        0,
        0,
        0,
        0,
        0,
        0,
        0,
        0,
        0,
        0,
        0,
        1
      ],
      [
        1,
        0,
        0,
        0,
        0,
        0,
        0,
        0,
        0,
        0,
        0,
        0,
        0,
        0,
        0,
        0,
        0,
        0,
        0,
        0,
        0,
        1
      ],
      [
        1,
        0,
        0,
        3,
        3,
        0,
        0,
        3,
        3,
        3,
        0,
        0,
        0,
        0,
        0,
        3,
        3,
        0,
        0,
        0,
        0,
        1
      ],
      [
        1,
        0,
        0,
        0,
        0,
        0,
        0,
        0,
        0,
        0,
        0,
        0,
        0,
        0,
        0,
        0,
        0,
        0,
        0,
        0,
        0,
        1
      ],
      [
        1,
        2,
        2,
        2,
        2,
        2,
        2,
        2,
        2,
        2,
        2,
        2,
        2,
        2,
        2,
        2,
        2,
        2,
        2,
        2,
        2,
        1
      ],
      [
        1,
        2,
        2,
        2,
        2,
        2,
        2,
        2,
        2,
        2,
        2,
        2,
        2,
        2,
        2,
        2,
        2,
        2,
        2,
        2,
        2,
        1
      ]
    ],
    "spawns": [
      {
        "entity": "VOLT_BOT",
        "x": 5,
        "y": 29
      },
      {
        "entity": "RAT_DRONE",
        "x": 12,
        "y": 24
      },
      {
        "entity": "RAT_DRONE",
        "x": 17,
        "y": 24
      },
      {
        "entity": "SLUDGE_BLOB",
        "x": 9,
        "y": 19
      },
      {
        "entity": "PIPE_SPIDER",
        "x": 14,
        "y": 14
      },
      {
        "entity": "CORE_MAINFRAME",
        "x": 11,
        "y": 2
      },
      {
        "entity": "BATTERY",
        "x": 13,
        "y": 24
      },
      {
        "entity": "BATTERY",
        "x": 4,
        "y": 19
      },
      {
        "entity": "BATTERY",
        "x": 18,
        "y": 14
      },
      {
        "entity": "BATTERY",
        "x": 9,
        "y": 9
      },
      {
        "entity": "BATTERY",
        "x": 16,
        "y": 9
      },
      {
        "entity": "SHIELD_PACK",
        "x": 7,
        "y": 24
      },
      {
        "entity": "SHIELD_PACK",
        "x": 12,
        "y": 14
      }
    ],
    "goal": {
      "kind": "entity",
      "entityId": "CORE_MAINFRAME"
    }
  }
]