[
  {
    "id": "1-1",
    "theme": "cursed dungeon",
    "size": [
      22,
      32
    ],
    "tiles": [
      [
        1,
        1,
        1,
        1,
        1,
        1,
        1,
        1,
        1,
        1,
        1,
        1,
        1,
        1,
        1,
        1,
        1,
        1,
        1,
        1,
        1,
        1
      ],
      [
        1,
        0,
        0,
        0,
        0,
        0,
        0,
        0,
        0,
        0,
        0,
        0,
        0,
        0,
        0,
        0,
        0,
        0,
        0,
        0,
        0,
        1
      ],
      [
        1,
        0,
        0,
        0,
        0,
        0,
        2,
        2,
        2,
        2,
        2,
        2,
        2,
        2,
        2,
        2,
        0,
        0,
        0,
        0,
        0,
        1
      ],
      [
        1,
        0,
        0,
        0,
        0,
        0,
        0,
        0,
        0,
        0,
        0,
        0,
        0,
        0,
        0,
        0,
        0,
        0,
        0,
        0,
        0,
        1
      ],
      [
        1,
        0,
        0,
        0,
        0,
        0,
        0,
        0,
        0,
        0,
        0,
        0,
        0,
        0,
        0,
        0,
        0,
        0,
        0,
        0,
        0,
        1
      ],
      [
        1,
        0,
        1,
        1,
        1,
        1,
        1,
        1,
        1,
        1,
        1,
        1,
        1,
        1,
        1,
        1,
        1,
        1,
        1,
        1,
        0,
        1
      ],
      [
        1,
        0,
        0,
        0,
        0,
        0,
        0,
        0,
        0,
        0,
        0,
        0,
        0,
        0,
        0,
        0,
        0,
        0,
        0,
        0,
        0,
        1
      ],
      [
        1,
        0,
        0,
        0,
        0,
        0,
        0,
        0,
        0,
        0,
        0,
        0,
        0,
        0,
        0,
        0,
        0,
        0,
        0,
        0,
        0,
        1
      ],
      [
        1,
        0,
        0,
        0,
        0,
        0,
        0,
        0,
        0,
        0,
        0,
        0,
        0,
        0,
        0,
        0,
        0,
        0,
        0,
        0,
        0,
        1
      ],
      [
        1,
        2,
        2,
        2,
        2,
        2,
        2,
        2,
        2,
        0,
        0,
        0,
        1,
        1,
        1,
        1,
        1,
        1,
        1,
        1,
        0,
        1
      ],
      [
        1,
        0,
        0,
        0,
        0,
        0,
        0,
        0,
        0,
        0,
        0,
        0,
        0,
        0,
        0,
        0,
        0,
        0,
        0,
        0,
        0,
        1
      ],
      [
        1,
        0,
        0,
        0,
        0,
        0,
        0,
        0,
        0,
        0,
        0,
        0,
        0,
        0,
        0,
        0,
        0,
        0,
        0,
        0,
        0,
        1
      ],
      [
        1,
        0,
        0,
        0,
        0,
        0,
        0,
        0,
        0,
        0,
        0,
        0,
        0,
        0,
        0,
        0,
        0,
        0,
        0,
        0,
        0,
        1
      ],
      [
        1,
        0,
        0,
        0,
        1,
        1,
        1,
        1,
        1,
        1,
        1,
        1,
        0,
        0,
        2,
        2,
        2,
        2,
        2,
        2,
        2,
        1
      ],
      [
        1,
        0,
        0,
        0,
        0,
        0,
        0,
        0,
        0,
        0,
        0,
        0,
        0,
        0,
        0,
        0,
        0,
        0,
        0,
        0,
        0,
        1
      ],
      [
        1,
        0,
        0,
        0,
        0,
        0,
        0,
        0,
        0,
        0,
        0,
        0,
        0,
        0,
        0,
        0,
        0,
        0,
        0,
        0,
        0,
        1
      ],
      [
        1,
        0,
        0,
        0,
        0,
        0,
        0,
        0,
        0,
        0,
        0,
        0,
        0,
        0,
        0,
        0,
        0,
        0,
        0,
        0,
        0,
        1
      ],
      [
        1,
        2,
        2,
        2,
        2,
        2,
        2,
        2,
        0,
        0,
        0,
        0,
        1,
        1,
        1,
        1,
        1,
        1,
        1,
        0,
        0,
        1
      ],
      [
        1,
        0,
        0,
        0,
        0,
        0,
        0,
        0,
        0,
        0,
        0,
        0,
        0,
        0,
        0,
        0,
        0,
        0,
        0,
        0,
        0,
        1
      ],
      [
        1,
        0,
        0,
        0,
        0,
        0,
        0,
        0,
        0,
        0,
        0,
        0,
        0,
        0,
        0,
        0,
        0,
        0,
        0,
        0,
        0,
        1
      ],
      [
        1,
        0,
        0,
        0,
        0,
        0,
        0,
        0,
        0,
        0,
        0,
        0,
        0,
        0,
        0,
        0,
        0,
        0,
        0,
        0,
        0,
        1
      ],
      [
        1,
        0,
        0,
        1,
        1,
        1,
        1,
        1,
        1,
        1,
        0,
        0,
        0,
        0,
        2,
        2,
        2,
        2,
        2,
        2,
        0,
        1
      ],
      [
        1,
        0,
        0,
        0,
        0,
        0,
        0,
        0,
        0,
        0,
        0,
        0,
        0,
        0,
        0,
        0,
        0,
        0,
        0,
        0,
        0,
        1
      ],
      [
        1,
        0,
        0,
        0,
        0,
        0,
        0,
        0,
        0,
        0,
        0,
        0,
        0,
        0,
        0,
        0,
        0,
        0,
        0,
        0,
        0,
        1
      ],
      [
        1,
        0,
        0,
        0,
        0,
        0,
        0,
        0,
        0,
        0,
        0,
        0,
        0,
        0,
        0,
        0,
        0,
        0,
        0,
        0,
        0,
        1
      ],
      [
        1,
        0,
        1,
        1,
        1,
        1,
        1,
        1,
        0,
        0,
        0,
        0,
        0,
        2,
        2,
        2,
        2,
        2,
        2,
        0,
        0,
        1
      ],
      [
        1,
        0,
        0,
        0,
        0,
        0,
        0,
        0,
        0,
        0,
        0,
        0,
        0,
        0,
        0,
        0,
        0,
        0,
        0,
        0,
        0,
        1
      ],
      [
        1,
        0,
        0,
        0,
        0,
        0,
        0,
        0,
        0,
        0,
        0,
        0,
        0,
        0,
        0,
        0,
        0,
        0,
        0,
        0,
        0,
        1
      ],
      [
        1,
        0,
        0,
        0,
        0,
        0,
        0,
        0,
        0,
        0,
        0,
        0,
        0,
        0,
        0,
        0,
        0,
        0,
        0,
        0,
        0,
        1
      ],
      [
        1,
        0,
        0,
        0,
        0,
        0,
        0,
        0,
        0,
        3,
        3,
        0,
        0,
        3,
        3,
        0,
        0,
        0,
        0,
        0,
        0,
        1
      ],
      [
        1,
        1,
        1,
        1,
        1,
        1,
        1,
        1,
        1,
        1,
        1,
        1,
        1,
        1,
        1,
        1,
        1,
        1,
        1,
        1,
        1,
        1
      ],
      [
        1,
        1,
        1,
        1,
        1,
        1,
        1,
        1,
        1,
        1,
        1,
        1,
        1,
        1,
        1,
        1,
        1,
        1,
        1,
        1,
        1,
        1
      ]
    ],
    "spawns": [
      {
        "entity": "KNIGHT",
        "x": 5,
        "y": 29
      },
      {
        "entity": "SKELETON",
        "x": 5,
        "y": 24
      },
      {
        "entity": "SLIME",
        "x": 15,
        "y": 24
      },
      {
        "entity": "GHOST",
        "x": 4,
        "y": 16
      },
      {
        "entity": "SKELETON",
        "x": 15,
        "y": 12
      },
      {
        "entity": "SLIME",
        "x": 8,
        "y": 8
      },
      {
        "entity": "ORB",
        "x": 7,
        "y": 24
      },
      {
        "entity": "ORB",
        "x": 16,
        "y": 20
      },
      {
        "entity": "ORB",
        "x": 7,
        "y": 12
      },
      {
        "entity": "ORB",
        "x": 15,
        "y": 8
      },
      {
        "entity": "ORB",
        "x": 10,
        "y": 4
      },
      {
        "entity": "DARK_KNIGHT",
        "x": 11,
        "y": 1
      }
    ],
    "goal": {
      "kind": "tile",
      "x": 10,
      "y": 1
    }
  }
]