[
  {
    "id": "1-1",
    "theme": "outdoor",
    "size": [
      22,
      12
    ],
    "tiles": [
      [
        3,
        0,
        0,
        0,
        0,
        0,
        0,
        0,
        0,
        0,
        0,
        0,
        0,
        0,
        0,
        0,
        0,
        0,
        0,
        0,
        0,
        3
      ],
      [
        3,
        0,
        0,
        0,
        0,
        0,
        0,
        0,
        0,
        0,
        0,
        0,
        0,
        0,
        0,
        0,
        0,
        0,
        0,
        0,
        0,
        3
      ],
      [
        3,
        0,
        0,
        0,
        0,
        0,
        0,
        0,
        0,
        0,
        0,
        0,
        0,
        0,
        0,
        0,
        0,
        0,
        0,
        0,
        0,
        3
      ],
      [
        3,
        0,
        0,
        0,
        0,
        0,
        0,
        0,
        0,
        0,
        0,
        0,
        0,
        0,
        0,
        0,
        0,
        0,
        0,
        0,
        0,
        3
      ],
      [
        3,
        0,
        0,
        0,
        0,
        0,
        1,
        1,
        1,
        0,
        0,
        0,
        1,
        1,
        0,
        0,
        0,
        0,
        0,
        0,
        0,
        3
      ],
      [
        3,
        0,
        0,
        0,
        0,
        0,
        2,
        2,
        2,
        0,
        0,
        0,
        2,
        2,
        1,
        1,
        0,
        0,
        0,
        0,
        0,
        3
      ],
      [
        3,
        0,
        0,
        0,
        0,
        0,
        0,
        0,
        0,
        1,
        1,
        0,
        0,
        0,
        2,
        2,
        0,
        0,
        0,
        0,
        0,
        3
      ],
      [
        3,
        0,
        0,
        1,
        1,
        1,
        0,
        0,
        0,
        2,
        2,
        0,
        0,
        0,
        0,
        0,
        0,
        0,
        0,
        0,
        0,
        3
      ],
      [
        3,
        0,
        0,
        2,
        2,
        2,
        0,
        0,
        0,
        0,
        1,
        1,
        1,
        0,
        0,
        0,
        0,
        0,
        0,
        0,
        0,
        3
      ],
      [
        3,
        0,
        0,
        0,
        0,
        0,
        0,
        0,
        0,
        0,
        2,
        2,
        2,
        0,
        0,
        0,
        0,
        0,
        0,
        0,
        0,
        3
      ],
      [
        1,
        1,
        1,
        1,
        1,
        1,
        1,
        1,
        1,
        1,
        1,
        1,
        1,
        1,
        1,
        1,
        1,
        1,
        1,
        1,
        1,
        1
      ],
      [
        2,
        2,
        2,
        2,
        2,
        2,
        2,
        2,
        2,
        2,
        2,
        2,
        2,
        2,
        2,
        2,
        2,
        2,
        2,
        2,
        2,
        2
      ]
    ],
    "spawns": [
      {
        "entity": "PETE",
        "x": 1,
        "y": 9
      },
      {
        "entity": "BAT",
        "x": 9,
        "y": 4
      },
      {
        "entity": "BAT",
        "x": 17,
        "y": 7
      },
      {
        "entity": "COIN",
        "x": 7,
        "y": 3
      },
      {
        "entity": "COIN",
        "x": 14,
        "y": 4
      },
      {
        "entity": "COIN",
        "x": 4,
        "y": 6
      },
      {
        "entity": "COIN",
        "x": 11,
        "y": 7
      },
      {
        "entity": "COIN",
        "x": 19,
        "y": 9
      }
    ],
    "goal": {
      "kind": "tile"
    }
  }
]