[
  {
    "id": "1-1",
    "theme": "magical island",
    "size": [
      20,
      15
    ],
    "tiles": [
      [
        1,
        1,
        1,
        1,
        1,
        1,
        1,
        1,
        1,
        1,
        1,
        1,
        1,
        1,
        1,
        1,
        1,
        1,
        1,
        1
      ],
      [
        1,
        4,
        4,
        4,
        0,
        0,
        0,
        0,
        0,
        0,
        0,
        0,
        0,
        0,
        0,
        0,
        4,
        4,
        4,
        1
      ],
      [
        1,
        4,
        4,
        4,
        0,
        0,
        0,
        0,
        0,
        0,
        0,
        0,
        0,
        0,
        0,
        0,
        4,
        4,
        4,
        1
      ],
      [
        1,
        4,
        4,
        4,
        0,
        0,
        0,
        3,
        3,
        3,
        3,
        3,
        0,
        0,
        0,
        0,
        4,
        4,
        4,
        1
      ],
      [
        1,
        0,
        0,
        0,
        0,
        2,
        2,
        0,
        0,
        0,
        0,
        0,
        0,
        2,
        2,
        0,
        0,
        0,
        0,
        1
      ],
      [
        1,
        0,
        0,
        0,
        0,
        2,
        2,
        0,
        0,
        4,
        4,
        0,
        0,
        2,
        2,
        0,
        0,
        0,
        0,
        1
      ],
      [
        1,
        0,
        0,
        0,
        0,
        0,
        0,
        0,
        0,
        4,
        4,
        0,
        0,
        0,
        0,
        0,
        0,
        0,
        0,
        1
      ],
      [
        1,
        0,
        0,
        0,
        0,
        0,
        0,
        0,
        0,
        4,
        4,
        0,
        0,
        0,
        0,
        0,
        0,
        0,
        0,
        1
      ],
      [
        1,
        0,
        0,
        0,
        0,
        0,
        0,
        0,
        0,
        0,
        0,
        0,
        0,
        0,
        0,
        0,
        0,
        0,
        0,
        1
      ],
      [
        1,
        0,
        0,
        0,
        3,
        3,
        3,
        3,
        0,
        0,
        0,
        0,
        0,
        0,
        0,
        0,
        0,
        0,
        0,
        1
      ],
      [
        1,
        0,
        0,
        0,
        0,
        0,
        0,
        0,
        0,
        0,
        0,
        0,
        3,
        3,
        3,
        3,
        0,
        0,
        0,
        1
      ],
      [
        1,
        4,
        4,
        4,
        0,
        0,
        0,
        0,
        0,
        0,
        0,
        0,
        0,
        0,
        0,
        0,
        4,
        4,
        4,
        1
      ],
      [
        1,
        4,
        4,
        4,
        0,
        0,
        0,
        0,
        0,
        0,
        0,
        0,
        0,
        0,
        0,
        0,
        4,
        4,
        4,
        1
      ],
      [
        1,
        4,
        4,
        4,
        0,
        0,
        0,
        0,
        0,
        0,
        0,
        0,
        0,
        0,
        0,
        0,
        4,
        4,
        4,
        1
      ],
      [
        1,
        1,
        1,
        1,
        1,
        1,
        1,
        1,
        1,
        1,
        1,
        1,
        1,
        1,
        1,
        1,
        1,
        1,
        1,
        1
      ]
    ],
    "spawns": [
      {
        "entity": "HERO",
        "x": 5,
        "y": 5
      },
      {
        "entity": "VILLAGER",
        "x": 10,
        "y": 3
      },
      {
        "entity": "FOREST_SPRITE",
        "x": 15,
        "y": 5
      },
      {
        "entity": "FOREST_SPRITE",
        "x": 14,
        "y": 10
      },
      {
        "entity": "STONE_GOLEM",
        "x": 3,
        "y": 10
      },
      {
        "entity": "WIZARD",
        "x": 10,
        "y": 12
      },
      {
        "entity": "HEART",
        "x": 8,
        "y": 3
      },
      {
        "entity": "HEART",
        "x": 7,
        "y": 9
      },
      {
        "entity": "HEART",
        "x": 15,
        "y": 8
      },
      {
        "entity": "HEART",
        "x": 5,
        "y": 12
      },
      {
        "entity": "HEART",
        "x": 12,
        "y": 6
      }
    ],
    "goal": {
      "kind": "entity",
      "entityId": "WIZARD"
    }
  }
]